{"capability_index_id":"CI-RUN-1","project_id":"PROJECT-1","run_id":"RUN-1","stage":"CODING","entries":[{"entry_id":"CAP-SOURCE-QUERY","kind":"INTERNAL_TOOL","name":"source-query","short_description":"在固定项目修订中查询源码符号和文本","source_ref":"registry:source-query","version":"1.0.0","input_hint":"symbol or text query","authority_class":"EXECUTION_CAPABILITY","load_policy":"DEFERRED","content_hash":"sha256:cccccccccccccccccccccccccccccccccccccccccccccccccccccccccccccccc"}],"generated_at":"2026-08-05T12:00:00Z"}
